{
  "schema_version": "1.0.0",
  "chain_id": "H04-F03-missing-learning",
  "scope_type": "ffet",
  "scope_id": "H04-F03",
  "source_hash": "1111111111111111111111111111111111111111111111111111111111111111",
  "artifact_bundle_hash": "3333333333333333333333333333333333333333333333333333333333333333",
  "closeout_hash": "5555555555555555555555555555555555555555555555555555555555555555",
  "ordered_links": [
    {
      "link_id": "source-record",
      "ref": "fixture://source/H04-F03-source.json",
      "sha256": "1111111111111111111111111111111111111111111111111111111111111111",
      "role": "source"
    },
    {
      "link_id": "validation-record",
      "ref": "fixture://validation/H04-F03-validation.json",
      "sha256": "2222222222222222222222222222222222222222222222222222222222222222",
      "role": "validation"
    },
    {
      "link_id": "artifact-bundle",
      "ref": "fixture://bundles/H04-F03-artifact-bundle.json",
      "sha256": "3333333333333333333333333333333333333333333333333333333333333333",
      "role": "artifact_bundle"
    },
    {
      "link_id": "closeout-record",
      "ref": "fixture://closeouts/H04-F03-closeout.json",
      "sha256": "5555555555555555555555555555555555555555555555555555555555555555",
      "role": "closeout"
    }
  ],
  "chain_status": "broken",
  "stale_links": [
    "closeout-record"
  ],
  "cannot_claim": [
    "h04_assurance_not_complete",
    "h04_record_generator_implemented",
    "H07_proof_engine_implemented"
  ]
}
